{
  "$schema": "https://json-schema.org/draft/2020-12/schema",
  "$id": "https://github.com/dreamforgestudiollc/EMET-GEMs/raw/main/gem.schema.json",
  "title": "EMET GEM manifest",
  "description": "gem.json for one Golem Expertise Module. Normative rules are in SPEC.md, revision 2026-10-12.",
  "type": "object",
  "additionalProperties": false,
  "required": [
    "spec",
    "id",
    "name",
    "description",
    "version",
    "kind",
    "requires",
    "priority",
    "defaultOn",
    "overrides",
    "distribution",
    "floor",
    "guides",
    "runes",
    "files",
    "authors",
    "license"
  ],
  "properties": {
    "spec": {
      "description": "GEM specification revision this manifest was written against.",
      "const": "2026-10-12"
    },
    "id": {
      "description": "Stable identifier. Unique among GEMs installed on one EMET.",
      "type": "string",
      "pattern": "^[a-z][a-z0-9-]{1,63}$"
    },
    "name": {
      "description": "Label shown to people. Not an identifier.",
      "type": "string",
      "minLength": 1,
      "maxLength": 80
    },
    "description": {
      "description": "One short summary served on gems_available.",
      "type": "string",
      "minLength": 1,
      "maxLength": 400
    },
    "version": {
      "description": "MAJOR.MINOR.PATCH. A suffix is refused. A leading zero is refused.",
      "type": "string",
      "pattern": "^(0|[1-9][0-9]{0,5})\\.(0|[1-9][0-9]{0,5})\\.(0|[1-9][0-9]{0,5})$"
    },
    "kind": {
      "enum": ["gem", "runed-gem"]
    },
    "requires": {
      "type": "object",
      "additionalProperties": false,
      "required": ["emet"],
      "properties": {
        "emet": {
          "description": "Semver range this GEM can seat in. This revision accepts an exact version or one leading comparator: >=, ^, or ~.",
          "type": "string",
          "pattern": "^(?:>=|\\^|~)?(0|[1-9][0-9]{0,5})\\.(0|[1-9][0-9]{0,5})\\.(0|[1-9][0-9]{0,5})$"
        }
      }
    },
    "priority": {
      "description": "0 to 100. Higher wins. A tie breaks by id, ascending byte order.",
      "type": "integer",
      "minimum": 0,
      "maximum": 100
    },
    "defaultOn": {
      "description": "Whether a fresh install activates this GEM before the user asks. Neurendipity is false.",
      "type": "boolean"
    },
    "released": {
      "description": "The socket seats this GEM only when the value is the boolean true. false, the string \"true\", 1, and null are refused. A missing field is allowed only for neurendipity 1.2.3 and fieldnote 1.0.1 when the id, the version, and every file digest match the pin in the socket. A shorter file list does not match. The pin covers the id, the version, and the file digests. It does not cover every other manifest field, including defaultOn, priority, requires, description, name, authors, license, rune description, schemas, the guides list, distribution, coverage, and rune metadata other than the version. overrides still needs SR-05 consent. A rune execution of server and distribution library are refused by GC-02. gem.json is not hashed: anyone who can edit it can already add released: true, so hashing it would grant nothing extra. Any other GEM missing the field is refused. The check runs on every boot. A read error refuses and does not turn the check off."
    },
    "overrides": {
      "description": "Modifiable core paths this GEM changes. Empty means it only adds lines. Core protection paths are refused.",
      "type": "array",
      "maxItems": 16,
      "uniqueItems": true,
      "items": {
        "type": "string",
        "pattern": "^[a-z][a-z0-9_]*(\\.[a-z][a-z0-9_]*)+$"
      }
    },
    "distribution": {
      "description": "bundled: shipped inside an EMET release. library: accepted through the submission gate.",
      "enum": ["bundled", "library"]
    },
    "floor": {
      "description": "Path of the floor document, relative to the GEM directory. Must also appear in files.",
      "type": "string",
      "pattern": "^(?!.*\\.\\.)[A-Za-z0-9][A-Za-z0-9./_-]*\\.json$"
    },
    "guides": {
      "description": "On-demand markdown. Not served at startup.",
      "type": "array",
      "maxItems": 16,
      "uniqueItems": true,
      "items": {
        "type": "string",
        "pattern": "^(?!.*\\.\\.)guides/[A-Za-z0-9][A-Za-z0-9./_-]*\\.md$"
      }
    },
    "runes": {
      "type": "array",
      "maxItems": 16,
      "items": { "$ref": "#/$defs/rune" }
    },
    "files": {
      "description": "Every content file, each once, with the digest and size of its raw bytes. gem.json itself is not listed.",
      "type": "array",
      "minItems": 1,
      "maxItems": 32,
      "items": { "$ref": "#/$defs/file" }
    },
    "authors": {
      "type": "array",
      "minItems": 1,
      "maxItems": 8,
      "items": { "type": "string", "minLength": 1, "maxLength": 120 }
    },
    "license": {
      "type": "string",
      "minLength": 1,
      "maxLength": 40
    },
    "changelog": {
      "description": "What changed in this GEM version. Optional. A string, a list, or an object of notes. The socket does not read it.",
      "anyOf": [
        { "type": "string", "maxLength": 65536 },
        { "type": "array", "maxItems": 64 },
        { "type": "object" }
      ]
    },
    "knowledge": {
      "description": "Optional notes or a corpus shipped with the GEM. A string, a list, or an object. The socket does not read it.",
      "anyOf": [
        { "type": "string", "maxLength": 65536 },
        { "type": "array", "maxItems": 64 },
        { "type": "object" }
      ]
    },
    "coverage": {
      "description": "Optional coverage notes shipped with the GEM. A string, a list of up to 256 entries, or an object. The socket does not read it. Lean Six Sigma ships this as a list of 90 entries.",
      "anyOf": [
        { "type": "string", "maxLength": 65536 },
        { "type": "array", "maxItems": 256 },
        { "type": "object" }
      ]
    },
    "update": {
      "description": "How this version relates to the previous release of the same GEM. Optional. The socket does not read it. class initial is the first release.",
      "type": "object",
      "properties": {
        "class": {
          "description": "initial for the first release of this GEM.",
          "type": "string",
          "minLength": 1,
          "maxLength": 40
        },
        "from": {
          "type": "string",
          "pattern": "^(0|[1-9][0-9]{0,5})\\.(0|[1-9][0-9]{0,5})\\.(0|[1-9][0-9]{0,5})$"
        },
        "notes": { "type": "string", "maxLength": 4000 }
      }
    },
    "signature": { "$ref": "#/$defs/signature" }
  },
  "allOf": [
    {
      "if": {
        "properties": { "distribution": { "const": "library" } },
        "required": ["distribution"]
      },
      "then": { "required": ["signature"] }
    },
    {
      "if": {
        "properties": { "kind": { "const": "gem" } },
        "required": ["kind"]
      },
      "then": { "properties": { "runes": { "maxItems": 0 } } }
    },
    {
      "if": {
        "properties": { "kind": { "const": "runed-gem" } },
        "required": ["kind"]
      },
      "then": { "properties": { "runes": { "minItems": 1 } } }
    }
  ],
  "$defs": {
    "file": {
      "type": "object",
      "additionalProperties": false,
      "required": ["path", "digest", "size"],
      "properties": {
        "path": {
          "type": "string",
          "pattern": "^(?!.*\\.\\.)[A-Za-z0-9][A-Za-z0-9./_-]*$"
        },
        "digest": {
          "description": "SHA-256 of the raw bytes, lowercase, prefixed with sha256:.",
          "type": "string",
          "pattern": "^sha256:[a-f0-9]{64}$"
        },
        "size": {
          "description": "Byte length of the same raw bytes.",
          "type": "integer",
          "minimum": 1,
          "maximum": 65536
        }
      }
    },
    "signature": {
      "type": "object",
      "additionalProperties": false,
      "required": ["alg", "keyid", "value"],
      "properties": {
        "alg": { "const": "Ed25519" },
        "keyid": {
          "type": "string",
          "pattern": "^[a-z0-9][a-z0-9._-]{0,63}$"
        },
        "value": {
          "description": "Standard base64 of the 64-byte Ed25519 signature.",
          "type": "string",
          "pattern": "^[A-Za-z0-9+/]{86}==$"
        }
      }
    },
    "rune": {
      "description": "A client-executed RUNED directive. The socket serves it and does not run it. reads and writes are empty.",
      "type": "object",
      "additionalProperties": false,
      "required": ["name", "description", "execution", "artifact", "sha256", "version", "runtime", "inputSchema", "outputSchema", "annotations", "reads", "writes", "network"],
      "properties": {
        "name": {
          "type": "string",
          "pattern": "^[a-zA-Z0-9_-]{1,64}$"
        },
        "title": { "type": "string", "minLength": 1, "maxLength": 80 },
        "description": { "type": "string", "minLength": 1, "maxLength": 4000 },
        "execution": { "const": "client" },
        "artifact": {
          "description": "Path of the code file, under runes/, and listed in files.",
          "type": "string",
          "pattern": "^runes/[A-Za-z0-9][A-Za-z0-9./_-]*\\.js$"
        },
        "sha256": {
          "description": "SHA-256 of the artifact's raw bytes, lowercase, prefixed with sha256:.",
          "type": "string",
          "pattern": "^sha256:[a-f0-9]{64}$"
        },
        "version": {
          "description": "The GEM semver. Same form as the manifest version. A suffix is refused. A leading zero is refused.",
          "type": "string",
          "pattern": "^(0|[1-9][0-9]{0,5})\\.(0|[1-9][0-9]{0,5})\\.(0|[1-9][0-9]{0,5})$"
        },
        "runtime": {
          "description": "Runtime the client needs to run the code.",
          "type": "string",
          "pattern": "^[a-z][a-z0-9.+-]{0,31}$"
        },
        "inputSchema": {
          "type": "object",
          "required": ["type"],
          "properties": { "type": { "const": "object" } }
        },
        "outputSchema": { "type": "object" },
        "annotations": {
          "type": "object",
          "additionalProperties": false,
          "required": ["readOnlyHint", "destructiveHint", "idempotentHint", "openWorldHint"],
          "properties": {
            "title": { "type": "string", "maxLength": 80 },
            "readOnlyHint": { "const": true },
            "destructiveHint": { "const": false },
            "idempotentHint": { "type": "boolean" },
            "openWorldHint": { "const": false }
          }
        },
        "reads": {
          "type": "array",
          "maxItems": 0,
          "items": { "$ref": "#/$defs/access" }
        },
        "writes": {
          "type": "array",
          "maxItems": 0,
          "items": { "$ref": "#/$defs/access" }
        },
        "network": { "const": "none" }
      }
    },
    "access": {
      "description": "A memory layer, or a document id prefix introduced by doc:.",
      "type": "string",
      "pattern": "^(identity|semantic|episodic|procedural|meta|working|doc:[A-Za-z0-9][A-Za-z0-9_./-]{0,80})$"
    }
  }
}
